{
  "schema_version": 1, "id": "m5go_bottom2", "name": "M5GO Bottom2", "origin": "official",
  "attaches": { "connector_type": "mbus", "occupies": "bottom" }, "compatible_with": ["m5stack_core2"],
  "host_pins": {
    "mbus.4": { "roles": ["conn:port_b.1"] }, "mbus.10": { "roles": ["conn:port_b.2"] },
    "mbus.15": { "roles": ["conn:port_c.1"] }, "mbus.16": { "roles": ["conn:port_c.2"] },
    "mbus.8": { "roles": ["dev:rgb_led.data"] }
  },
  "connectors": {
    "port_b": { "type": "hy2_4p", "standard": "port_io" },
    "port_c": { "type": "hy2_4p", "standard": "port_uart" }
  },
  "devices": { "rgb_led": { "kind": "led_strip", "part": "sk6812", "spec": { "count": 10 } } }
}
